id,title,subtitle,description,price,currency,category,cta_label,is_active,sort_order,created_at,updated_at
66cdf858-b590-4c9e-8134-ea3ddc53a019,你不是太脆弱，是神經系統太累了,電子書,寫給每一個明明努力了，身體卻還是很累的人,350,TWD,ebook,立即購買,t,6,2026-03-31 03:49:34.545082+00,2026-03-31 03:49:34.545082+00
d95105aa-ef69-4b6f-b27f-b576ef251b45,森林療癒半日體驗（台中場）,實體活動,由 ANFT 認證森林療癒師 Kaia 帶領，在台中周邊自然場域,2800,TWD,event,立即報名,t,7,2026-03-31 03:49:34.545082+00,2026-03-31 03:49:34.545082+00
3aaf6e2c-bcbb-438a-9d5b-73976da31e3b,實體瑜珈工作坊,實體活動,由 Kaia 帶領的小班制瑜珈工作坊,1200,TWD,event,立即報名,t,8,2026-03-31 03:49:34.545082+00,2026-03-31 03:49:34.545082+00
170fd0ce-6375-41ca-a058-492019c0c03b,神經系統入門課：從科學到日常練習,給總是緊繃、卻說不清楚為什麼的你，學會讀懂身體的訊號，從科學到日常練習,認識你的神經系統、壓力反應的科學、迷走神經與安全感、5個日常調節練習、建立你的放鬆儀式,1280,TWD,online_course,立即購買,t,1,2026-03-31 03:49:34.545082+00,2026-04-09 03:02:40.048839+00
92ea4d6b-fd51-465a-84eb-c59b81be3079,陰瑜珈序列自學課：找到身體的邊界,不需要柔軟度，只需要願意停下來，透過長時間的靜止與呼吸，讓身體慢慢學會放鬆,陰瑜珈的哲學、基礎序列教學、髖部釋放序列、脊椎放鬆序列、睡前修復序列,1480,TWD,online_course,立即購買,t,2,2026-03-31 03:49:34.545082+00,2026-04-09 03:02:40.048839+00
e061d896-26a1-4491-94e7-6a368c60845c,陰瑜珈小班制（包月方案）,小班即時陪伴，讓練習真正發生，一個月裡每週帶領你固定練習，讓身心慢慢找回節奏,每週一堂線上小班課，由 Kaia 親自帶領,1200,TWD,live_class,申請加入,t,4,2026-03-31 03:49:34.545082+00,2026-04-09 03:02:48.190502+00
0c4495e8-8281-47a9-acf0-3a31609dc242,單堂體驗,一個月每週帶領你固定練習，讓身心慢慢找回節奏,先試試看，感受 Kaia 的教學風格,380,TWD,live_class,申請加入,t,5,2026-03-31 03:49:34.545082+00,2026-04-09 03:03:02.65863+00
